{
  "$schema": "https://json-schema.org/draft/2020-12/schema",
  "type": "object",
  "properties": {
    "dealId": {
      "type": "string",
      "format": "uuid",
      "pattern": "^([0-9a-fA-F]{8}-[0-9a-fA-F]{4}-7[0-9a-fA-F]{3}-[89abAB][0-9a-fA-F]{3}-[0-9a-fA-F]{12})$"
    },
    "side": {
      "type": "string",
      "enum": [
        "A",
        "B"
      ]
    },
    "lawyerNonce": {
      "type": "string",
      "pattern": "^[0-9a-f]{64}$"
    },
    "signature": {
      "type": "string",
      "pattern": "^[0-9a-f]{128}$"
    }
  },
  "required": [
    "dealId",
    "side",
    "lawyerNonce",
    "signature"
  ],
  "additionalProperties": false
}
