[
  {
    "dealId": "0192f0c8-3c4e-7a2b-8c3d-4e5f6a7b8c9d",
    "side": "A",
    "lawyerNonce": "abababababababababababababababababababababababababababababababab",
    "signature": "cdcdcdcdcdcdcdcdcdcdcdcdcdcdcdcdcdcdcdcdcdcdcdcdcdcdcdcdcdcdcdcdcdcdcdcdcdcdcdcdcdcdcdcdcdcdcdcdcdcdcdcdcdcdcdcdcdcdcdcdcdcdcdcd"
  }
]
